{
  "$schema": "https://fadeno.dev/schemas/experiment/revalidation-qualification-schedule-golden-v1.json",
  "schemaVersion": 1,
  "scheduleSha256": "6a3bb897a8ba375dfe13e1e809a57e4975e17fbcd9b8b08e6326e19fca715c2c",
  "orderSha256": "a4f8e6a35d0090b2ecce578e6250da2ee3849d9d9a176faf42211b98069bec76",
  "cycles": 10000,
  "successCycles": 8056,
  "expectedErrorCycles": 1944,
  "first": {
    "id": "c00000",
    "path": "s",
    "readOrder": "251804673",
    "expectedDigest": "s"
  },
  "last": {
    "id": "c09999",
    "path": "e",
    "readOrder": "065432871",
    "expectedDigest": "b"
  }
}
